{
  "repo_url": "https://github.com/warproxxx/poly-maker",
  "repo_name": "warproxxx/poly-maker",
  "profile_used": "prediction_market_execution",
  "summary_of_what_it_is": "An automated market making bot for Polymarket that provides liquidity by maintaining orders on both sides of the order book with customizable parameters   configured via Google Sheets.",
  "classification": "marginal",
  "confidence": 0.6,
  "repo_reality_score": 34,
  "our_fit_score": 34,
  "novelty_flag": 2,
  "fatal_flags_triggered": [
    "direct_secret_or_key_sloppiness",
    "no_paper_mode"
  ],
  "top_positive_signals": [
    "README exists and provides inspectable context.",
    "Top-level code artifacts are present.",
    "Config/build files suggest implementable structure.",
    "Language footprint detected (2 languages).",
    "Repository has a recorded update timestamp."
  ],
  "top_negative_signals": [
    "No major negative signal found in bounded static pass.",
    "Fatal flag: direct_secret_or_key_sloppiness",
    "Fatal flag: no_paper_mode"
  ],
  "danger_flags": [
    "Fatal: direct_secret_or_key_sloppiness",
    "Fatal: no_paper_mode"
  ],
  "top_files_to_inspect": [
    "README.md",
    "pyproject.toml"
  ],
  "best_fit_for_us": "Pattern extraction for prediction-market execution research",
  "what_to_steal": [
    "Bounded workflow and scoring patterns",
    "Clear evidence-first repo review mechanics"
  ],
  "what_not_to_steal": [
    "Unbounded autonomous behavior",
    "Any approach requiring direct repo code execution for triage"
  ],
  "deeper_review_recommended": true,
  "deeper_review_questions": [
    "What claims require non-execution evidence before deeper review?",
    "Which components are reusable without importing full repo complexity?"
  ],
  "worker_status": "escalated",
  "stop_condition": null,
  "escalation_triggered": true,
  "escalation_reasons": [
    "fatal flag triggered but repo still appears strategically interesting"
  ],
  "final_disposition": "marginal"
}