{
  "repo_url": "https://github.com/aulekator/Polymarket-BTC-15-Minute-Trading-Bot",
  "repo_name": "aulekator/Polymarket-BTC-15-Minute-Trading-Bot",
  "profile_used": "generic_repo_triage",
  "summary_of_what_it_is": "A production-grade algorithmic trading bot for Polymarket's 15-minute BTC price prediction markets. Built with a 7-phase architecture combining multiple signal sources, professional risk management, and self-learning capabilities.",
  "classification": "marginal",
  "confidence": 0.62,
  "repo_reality_score": 47,
  "our_fit_score": 16,
  "novelty_flag": 6,
  "fatal_flags_triggered": [
    "obvious_secret_sloppiness"
  ],
  "top_positive_signals": [
    "README exists and provides inspectable context.",
    "Top-level code artifacts are present.",
    "Config/build files suggest implementable structure.",
    "Test-related files/directories appear present.",
    "Language footprint detected (1 languages)."
  ],
  "top_negative_signals": [
    "No major negative signal found in bounded static pass.",
    "Fatal flag: obvious_secret_sloppiness"
  ],
  "danger_flags": [
    "Fatal: obvious_secret_sloppiness"
  ],
  "top_files_to_inspect": [
    "README.md",
    "requirements.txt"
  ],
  "best_fit_for_us": "Workflow/operator support",
  "what_to_steal": [
    "Bounded workflow and scoring patterns",
    "Clear evidence-first repo review mechanics"
  ],
  "what_not_to_steal": [
    "Unbounded autonomous behavior",
    "Any approach requiring direct repo code execution for triage"
  ],
  "deeper_review_recommended": true,
  "deeper_review_questions": [
    "What claims require non-execution evidence before deeper review?",
    "Which components are reusable without importing full repo complexity?"
  ],
  "worker_status": "escalated",
  "stop_condition": null,
  "escalation_triggered": true,
  "escalation_reasons": [
    "fatal flag triggered but repo still appears strategically interesting"
  ],
  "final_disposition": "marginal"
}