{
  "repo_url": "https://github.com/Anoto-ecossistem/polymarket-copy-bot",
  "repo_name": "Anoto-ecossistem/polymarket-copy-bot",
  "profile_used": "prediction_market_execution",
  "summary_of_what_it_is": "Polymarket copy bot & polymarket copy trading bot \u2014 real-time mirror/copy trading on Polymarket prediction markets. Copy a wallet's trades automatically with configurable size and auto-redemption. Polymarket copy bot & polymarket copy trading bot & polymarket copytrading bot  Polymarket copy bot & polymarket copy trading bot &polymarket copytrading",
  "classification": "too_fuzzy",
  "confidence": 0.41,
  "repo_reality_score": 17,
  "our_fit_score": 34,
  "novelty_flag": 2,
  "fatal_flags_triggered": [
    "direct_secret_or_key_sloppiness",
    "no_paper_mode"
  ],
  "top_positive_signals": [
    "README exists and provides inspectable context.",
    "Config/build files suggest implementable structure.",
    "Language footprint detected (1 languages).",
    "Repository has a recorded update timestamp."
  ],
  "top_negative_signals": [
    "Little or no top-level code surface detected.",
    "Fatal flag: direct_secret_or_key_sloppiness",
    "Fatal flag: no_paper_mode"
  ],
  "danger_flags": [
    "Fatal: direct_secret_or_key_sloppiness",
    "Fatal: no_paper_mode"
  ],
  "top_files_to_inspect": [
    "README.md",
    "package-lock.json",
    "package.json",
    "src"
  ],
  "best_fit_for_us": "Pattern extraction for prediction-market execution research",
  "what_to_steal": [
    "Bounded workflow and scoring patterns",
    "Clear evidence-first repo review mechanics"
  ],
  "what_not_to_steal": [
    "Unbounded autonomous behavior",
    "Any approach requiring direct repo code execution for triage"
  ],
  "deeper_review_recommended": true,
  "deeper_review_questions": [
    "What claims require non-execution evidence before deeper review?",
    "Which components are reusable without importing full repo complexity?"
  ],
  "worker_status": "escalated",
  "stop_condition": null,
  "escalation_triggered": true,
  "escalation_reasons": [
    "fatal flag triggered but repo still appears strategically interesting"
  ],
  "final_disposition": "too_fuzzy"
}